{
  "$schema": "https://json-schema.org/draft/2020-12/schema",
  "$id": "https://ravel.dev/schema/ravel-map-v1.json",
  "title": "Ravel Map v1",
  "type": "object",
  "required": ["version", "document", "chunks"],
  "additionalProperties": false,
  "properties": {
    "version": { "const": 1 },
    "document": { "$ref": "#/$defs/document" },
    "chunks": {
      "type": "array",
      "items": { "$ref": "#/$defs/chunk" }
    },
    "directives": {
      "type": "array",
      "items": { "$ref": "#/$defs/directive" },
      "default": []
    },
    "metadata": { "type": "object", "additionalProperties": true }
  },
  "$defs": {
    "component": {
      "type": "string",
      "pattern": "^[a-z][a-z0-9-]*$"
    },
    "chunkPath": {
      "type": "string",
      "pattern": "^[a-z][a-z0-9-]*(?:/(?:[a-z][a-z0-9-]*)?)*$"
    },
    "address": {
      "type": "string",
      "pattern": "^(?:[a-z][a-z0-9-]*::(?:[a-z][a-z0-9-]*(?:/(?:[a-z][a-z0-9-]*)?)*)?(?::[a-z][a-z0-9-]*)?(?:\\.[a-z][a-z0-9-]*)?|[a-z][a-z0-9-]*(?:/(?:[a-z][a-z0-9-]*)?)*(?::[a-z][a-z0-9-]*)?(?:\\.[a-z][a-z0-9-]*)?)$"
    },
    "position": {
      "type": "object",
      "required": ["line", "column", "offset"],
      "additionalProperties": false,
      "properties": {
        "line": { "type": "integer", "minimum": 0 },
        "column": { "type": "integer", "minimum": 0 },
        "offset": { "type": "integer", "minimum": 0 }
      }
    },
    "range": {
      "type": "object",
      "required": ["start", "end"],
      "additionalProperties": false,
      "properties": {
        "start": { "$ref": "#/$defs/position" },
        "end": { "$ref": "#/$defs/position" }
      }
    },
    "source": {
      "type": "object",
      "required": ["uri", "range"],
      "additionalProperties": false,
      "properties": {
        "uri": { "type": "string", "format": "uri-reference" },
        "range": { "$ref": "#/$defs/range" }
      }
    },
    "document": {
      "type": "object",
      "required": ["id", "uri", "format"],
      "additionalProperties": false,
      "properties": {
        "id": { "$ref": "#/$defs/component" },
        "uri": { "type": "string", "format": "uri-reference" },
        "format": { "type": "string", "minLength": 1 }
      }
    },
    "transform": {
      "type": "object",
      "required": ["name"],
      "additionalProperties": false,
      "properties": {
        "name": { "$ref": "#/$defs/component" },
        "arguments": { "type": "array", "items": {} }
      }
    },
    "fragment": {
      "type": "object",
      "required": ["body", "source"],
      "additionalProperties": false,
      "properties": {
        "body": { "type": "string" },
        "source": { "$ref": "#/$defs/source" },
        "precision": {
          "type": "string",
          "enum": ["exact", "coarse"],
          "default": "exact"
        }
      }
    },
    "chunk": {
      "type": "object",
      "required": ["id", "identity", "body", "source"],
      "additionalProperties": false,
      "properties": {
        "id": { "$ref": "#/$defs/address" },
        "identity": { "$ref": "#/$defs/chunkIdentity" },
        "name": { "type": "string", "minLength": 1 },
        "body": { "type": "string" },
        "definitionPipeline": {
          "type": "array",
          "items": { "$ref": "#/$defs/transform" },
          "default": []
        },
        "metadata": {
          "type": "object",
          "properties": {
            "language": { "type": "string" },
            "tags": { "type": "array", "items": { "type": "string" } },
            "data": {
              "type": "object",
              "properties": {
                "ravel": {
                  "type": "object",
                  "properties": {
                    "run": { "type": "boolean" },
                    "provider": { "type": "string", "minLength": 1 }
                  },
                  "additionalProperties": true
                }
              },
              "additionalProperties": true
            }
          },
          "additionalProperties": true
        },
        "source": { "$ref": "#/$defs/source" },
        "fragments": {
          "type": "array",
          "items": { "$ref": "#/$defs/fragment" }
        }
      }
    },
    "chunkIdentity": {
      "type": "object",
      "required": ["document", "chunk", "minor", "type"],
      "additionalProperties": false,
      "anyOf": [
        { "properties": { "document": { "$ref": "#/$defs/component" } } },
        { "properties": { "chunk": { "$ref": "#/$defs/component" } } }
      ],
      "properties": {
        "document": { "anyOf": [{ "$ref": "#/$defs/component" }, { "type": "null" }] },
        "chunk": { "anyOf": [{ "$ref": "#/$defs/chunkPath" }, { "type": "null" }] },
        "minor": { "anyOf": [{ "$ref": "#/$defs/component" }, { "type": "null" }] },
        "type": { "anyOf": [{ "$ref": "#/$defs/component" }, { "type": "null" }] }
      }
    },
    "directive": {
      "type": "object",
      "required": ["kind", "source"],
      "additionalProperties": false,
      "allOf": [
        { "if": { "properties": { "kind": { "const": "in" } } }, "then": { "required": ["target"] } },
        { "if": { "properties": { "kind": { "const": "out" } } }, "then": { "required": ["name", "from"] } },
        { "if": { "properties": { "kind": { "const": "create" } } }, "then": { "required": ["document", "name", "compose"] } },
        { "if": { "properties": { "kind": { "const": "alias" } } }, "then": { "required": ["document", "name", "reference"] } }
      ],
      "properties": {
        "kind": { "enum": ["in", "out", "create", "alias"] },
        "name": { "type": "string", "minLength": 1 },
        "from": { "$ref": "#/$defs/address" },
        "target": { "type": "string", "minLength": 1 },
        "arguments": { "type": "array", "items": {} },
        "metadata": { "type": "object", "additionalProperties": true },
        "source": { "$ref": "#/$defs/source" },
        "document": { "$ref": "#/$defs/component" },
        "compose": { "type": "array", "items": {} },
        "reference": { "type": "string" },
        "body": { "type": "string" }
      }
    }
  }
}
