{
  "version": 1,
  "document": {
    "id": "greeting",
    "uri": "examples/greeting.md",
    "format": "markdown+ravel-v1"
  },
  "chunks": [
    {
      "id": "greeting::main",
      "identity": { "document": "greeting", "chunk": "main", "minor": null, "type": null },
      "name": "Main program",
      "body": "console.log(_\"format-greeting\");\n",
      "definitionPipeline": [],
      "metadata": {
        "language": "javascript",
        "tags": ["entrypoint"]
      },
      "source": {
        "uri": "examples/greeting.md",
        "range": {
          "start": { "line": 8, "column": 0, "offset": 88 },
          "end": { "line": 10, "column": 3, "offset": 138 }
        }
      }
    },
    {
      "id": "greeting::format-greeting",
      "identity": { "document": "greeting", "chunk": "format-greeting", "minor": null, "type": null },
      "name": "Greeting formatter",
      "body": "function formatGreeting(name) { return 'Hello, ' + name + '!'; }\n",
      "metadata": {
        "language": "javascript"
      },
      "source": {
        "uri": "examples/greeting.md",
        "range": {
          "start": { "line": 14, "column": 0, "offset": 194 },
          "end": { "line": 16, "column": 3, "offset": 268 }
        }
      }
    }
  ],
  "directives": [
    {
      "kind": "out",
      "from": "greeting::main",
      "name": "dist/greeting.js",
      "source": {
        "uri": "examples/greeting.md",
        "range": {
          "start": { "line": 18, "column": 0, "offset": 270 },
          "end": { "line": 18, "column": 57, "offset": 327 }
        }
      }
    }
  ]
}
